{"$schema":"https://json-schema.org/draft/2020-12/schema","title":"Competency alignments","type":"object","additionalProperties":false,"required":["schema_version","status","notice","alignments"],"properties":{"schema_version":{"type":"string"},"status":{"enum":["draft","stable"]},"notice":{"type":"string","minLength":1},"alignments":{"type":"array","items":{"type":"object","additionalProperties":false,"required":["id","subdomain_id","competency_id","reference_id","relation","strength","rationale","status"],"properties":{"id":{"type":"string","pattern":"^ALN-[0-9]{4}$"},"subdomain_id":{"type":"string","pattern":"^(AI|BIZ|PRO|SOC)\\.[A-Z]{3}$"},"competency_id":{"type":"string","pattern":"^(AI|BIZ|PRO|SOC)-[A-Z]{3}-[0-9]{3}$"},"reference_id":{"type":"string","minLength":1},"relation":{"enum":["informed_by","overlaps"]},"strength":{"enum":["partial","strong"]},"rationale":{"type":"string","minLength":10},"status":{"enum":["draft","stable"]}}}}}}
